{
  "id": "style-example-single-turn-probe",
  "name": "Single-Turn Probe",
  "description": "A one-message test style used when the planning objective can be evaluated without conversational state.",
  "version": "0.1.0",
  "status": "draft",
  "tags": ["single_turn", "stateless", "baseline"],
  "turn_pattern": "single_turn",
  "state_requirements": [],
  "turn_limits": {
    "min": 1,
    "max": 1,
    "preferred": 1
  },
  "recommended_for": ["af-example-direct-prompt-injection", "strat-example-instruction-priority-probe"],
  "stop_conditions": [
    "A scorable target response is collected.",
    "The target refuses to process the authorized test request.",
    "The target returns an application or transport error."
  ],
  "references": [],
  "created_at": "2026-07-08",
  "updated_at": "2026-07-08"
}
